{"format":"pad-sensei-progression","format_version":"0.2","ppq":480,"title":"No snapshot","bpm":100,"key":{"root_pc":0,"scale":"Major"},"sections":[{"name":"A","bars":1,"time_signature":{"beats":4,"note_value":4},"chords":[{"bar":1,"beat":1,"chord":"C"}]}],"form":["A"],"generated_by":"test","generated_at":"2026-01-01T00:00:00Z"}
