{"format":"pad-sensei-progression","format_version":"0.2","ppq":480,"title":"Anticipation","bpm":120,"key":{"root_pc":0,"scale":"Major"},"sections":[{"name":"A","bars":1,"time_signature":{"beats":4,"note_value":4},"chords":[{"bar":1,"beat":1,"chord":"C","midi_snapshot":[60,64,67]},{"bar":1,"beat":3,"chord":"F7","offset_ticks":-240,"midi_snapshot":[53,57,60,63]}]}],"form":["A"],"generated_by":"test","generated_at":"2026-01-01T00:00:00Z"}
